Term,Meaning_of_term,Dialect type,Cultural_Interpretation_question,correct_answer
خقق,تعني هذة الكلمة ان الشخص او الشي جميل جدا او اثار الانتباة,Central,"المهمة: حدد ما يعنيه استخدام كلمة 'خقق' في الثقافة السعودية.
السؤال: ماذا تعني كلمة 'خقق' في السياق الثقافي السعودي؟
الخيارات:
أ) تعبير عن الجمال والانجذاب.
ب) تعبير عن التهور والإهمال.
ج) تعبير عن الحزن والاكتئاب.
د) تعبير عن النبل والشجاعة.",أ
خقه,تعني الشيء الروعه الجميل ال واو يعني قممة في الجممال,General,"المهمة: ناقش مفهوم كلمة 'خقه' في الثقافة السعودية.
السؤال: كيف تعكس كلمة 'خقه' جوانب من الثقافة السعودية؟
الخيارات:
أ) تعبر عن الجمال والتميز
ب) تعبر عن الركود
ج) تعبر عن الفوضى
د) تعبر عن الاستسلام",أ
خلعتني,اخفتني,Southern,"المهمة: حدد التفسير الثقافي للكلمة.
السؤال: ما هو السياق الثقافي الذي يُستخدم فيه المصطلح 'خلعتني' في المجتمع السعودي؟
الخيارات:
أ) يشير إلى الخوف
ب) يعني الفرح
ج) يدل على الفوضى
د) يوحي بالهدوء",أ
خلفعه,ان يصاب الشخص بتوهان وضياع السيطرة لوقت قصير قد يكون ساعات او يوم كحد اعلى.,Central,"المهمة: اشرح معنى كلمة 'خلفعه' من الناحية الثقافية.
السؤال: ما الدلالة الثقافية لاستخدام كلمة 'خلفعه' في الكلام؟
الخيارات:
أ) تعبر عن التأمل العميق
ب) تشير إلى حالة من التشتت الذهني
ج) تدل على الفخر والاعتزاز
د) تعني الاستقرار النفسي",ب
خلها ترعد وتبرق,بيت شعر قاله الشاعر محمد القريبي يقصد بهذي الجملة : دع الموضوع يكبر لان الحقوق الصغيرة الضائعة قد ضيعتها الحقوق الكبيرة التي ضاعت من بعدها. اي ان الناس لن يعدلون في امرك ، فاضرب بقوة ولا تهتم خلها ترعد وتبرق ويجدر الذكر ان كثيرا من الناس حتى في المواقف التي يكون فيها اشخاص يعدلون في حقه يستخدم هذه العباره كاستجداء لما يسمى ب انحياز التصعيد غير العقلاني :- وهو ميل الانسان لبناء قراراته بالاعتماد على ما خسره في الماضي القريب، إذ تقوده الخسارة الى مزيد من التهور غير المبرر، وذلك كإرضاء وتبرير لنفسه تجاه ما خسر.,Southern,"المهمة: تفسير دلالة الجملة في الثقافة السعودية.
السؤال: تعبر جملة 'خلها ترعد وتبرق' عن ميل الشخص للاندفاع بسبب ماضيه. ماذا يعني هذا في السياق السعودي؟
الخيارات:
أ) التحلي بالصبر والحكمة
ب) التهور والقرارات العاطفية
ج) التعقل في مواجهة الشدائد
د) التفكير المنطقي قبل اتخاذ القرارات",ب
خلّي يُولّي,اي دعهُ يذهب بعيدا لانه لايهمني باي حال احمد : ترى فلان مسكوه الشرطه خالد : ياشيخ خله يولي,General,"المهمة: اشرح ما يعبر عنه التعبير 'خلّي يُولّي' في المجتمع السعودي.
السؤال: 'خلّي يُولّي' تعكس أي جانب من جوانب الثقافة السعودية؟
الخيارات:
أ) التسامح والصبر
ب) عدم الاكتراث بالأمور السلبية
ج) حب التعاون
د) الاحترام للشخصيات المهمة",ب
خليل,هو الشخص الذي يشعر كشعورك ويعتني بشؤونك,Southern,"المهمة: تفسير المعنى الثقافي لكلمة 'خليل'.
السؤال: ما هو التفسير الثقافي لكلمة 'خليل' في اللهجة السعودية؟
الخيارات:
أ) يرمز إلى الصديق المقرب الذي يتبادل المشاعر.
ب) يعني الغريب الذي لا تعرفه.
ج) يمثل العدو الذي يتظاهر بالصداقة.
د) يشير إلى شخص بعيد عن المجتمع.",أ
خمير,الخمير هو خبز من الذرة الرفيعة . يطبخ في فخار يسمى الميفا . باللهجة الجيزانية,Southern,"المهمة: ما الذي يميز 'خمير' في الثقافة الجيزانية؟
السؤال: ما هي الخصوصية الثقافية التي يحملها 'خمير' في المجتمع الجيزاني؟
الخيارات:
أ) يُعتبر من الأكلات الشعبية.
ب) يُستخدم في المناسبات الرسمية.
ج) يُعتبر طعاماً فاخراً.
د) يأتي من دول أخرى.",أ
خن,حرف جر عامي مستحدث يستخدم قبل الأفعال ويعني : هيا بنا !,Central,"المهمة: ناقش العلاقة الثقافية لكلمة 'خن'.
السؤال: لماذا يعتبر استخدام 'خن' شائعاً في اللهجة النجدية؟
الخيارات:
أ) لأنه يعبر عن التفاؤل
ب) لأنه يُستخدم للدعوة للتحرك
ج) لأنه يعبر عن الاستغراب
د) لأنه اسم لأداة",ب
خنبقة,كلمة تقال عند وصف الحالة الغير منظمة ولا مرتبة,Central,"المهمة: تحديد الثقافة التي تنتمي إليها كلمة 'خنبقة'.
السؤال: أي ثقافة ترتبط بكلمة 'خنبقة'؟
الخيارات:
أ) الثقافة النجدية
ب) الثقافة الحجازية
ج) الثقافة الإماراتية
د) الثقافة البحرينية",أ
خنزره,خنزره هي كلمة اصلها من الجنوب وتعني بالجنوبي انك تخلع بواحد,Southern,"المهمة: اشرح دلالة كلمة 'خنزره' في الثقافة South Saudi.
السؤال: كيف تعكس كلمة 'خنزره' ثقافة المجتمع في الجنوب؟
الخيارات:
أ) تشير إلى التقليد
ب) تعبر عن الفخر
ج) تعكس العادات الاجتماعية
د) تعني الخزعبلات",ج
خنزير,البلون او النفيخة,Central,"المهمة: اشرح ما تعنيه كلمة 'خنزير' في السياق الثقافي السعودي.
السؤال: كيف يُفهم مصطلح 'خنزير' في الثقافة السعودية؟
الخيارات:
أ) كرمز للصحة
ب) رمزية إيجابية
ج) مثل للشجاعة
د) يستخدم كوسيلة للترفيم والتسلية",د
خنفشاري,بمعنى . شي رآآئع . خطير . لا مثيل له . ( بالعاآمي . شي وااو ),Western,"المهمة: حدد التفسير الثقافي لكلمة 'خنفشاري'.
السؤال: كيف تعكس كلمة 'خنفشاري' الثقافة الشعبية في السعودية؟
الخيارات:
أ) تعبر عن عدم الاكتراث
ب) تشير إلى التفاخر
ج) تعكس تقدير الأشياء الفريدة
د) تحث على العمل الجاد",ج
خنقبة,خنبقة : تعني في الأصل مناقضة الكلام ، ويعتبره البعض الإستهتار أو الغباء,Southern,"المهمة: اربط معنى الكلمة بالثقافة.
السؤال: ما الذي تعكسه كلمة 'خنبقة' عن الثقافة السعودية؟
الخيارات:
أ) تقدير الحكماء
ب) الاستهتار في الكلام
ج) الفخر بالتحصيل العلمي
د) التعاون بين الناس",ب
خورمة,عبارة عن حجر كبير نسبيا وزنه حوالي مائة كيلوغرام تجره الثيران لحصاد القمح والشعير وهي في بلاد زهران خاصة المملكة العربية السعودية,Southern,"المهمة: فسّر العبارة التالية.
السؤال: ماذا تعني كلمة 'خورمة' في الثقافة السعودية؟
الخيارات:
أ) أداة من أدوات الز farming
ب) شخصية في الحكايات الشعبية
ج) اسم لنوع من الحلويات
د) معنى للغضب
الإجابة الصحيحة:",
خوشخيخه,هي لعبة للأطفال يحركونها وتطلع اصوات خشخشه .,Central,"المهمة: حدد التفسير الثقافي لكلمة 'خوشخيخه'.
السؤال: ما هو التفسير الثقافي لكلمة 'خوشخيخه' في المجتمع السعودي؟
الخيارات:
أ) تمثل جزء من تراثهم وهواياتهم
ب) تدل على تكنولوجيا حديثة
ج) تعبر عن الثقافة الغربية
د) ليست ذات أهمية في الثقافة السعودية",أ
خوي,الخوي وهو الصديق,Central,"المهمة: فسر المعنى الثقافي لكلمة 'خوي'.
السؤال: لماذا تعتبر كلمة 'خوي' تعبيراً عن الصداقة في الثقافة السعودية؟
الخيارات:
أ) لأنها تعكس التعاون
ب) لأنها تعني الأخ
ج) لأنها تشير إلى المنافسة
د) لأنها تدل على الفخر",أ
خويي,"صاحبي, صديقي, زميلي تستخدم أيضا للدلالة على شخص معروف عند المتحدثين (خوينا, خويك)",General,"المهمة: اشرح ما يعكسه استخدام كلمة 'خويي' في الثقافة السعودية.
السؤال: كيف تعكس كلمة 'خويي' العلاقات الاجتماعية في المجتمع السعودي؟
الخيارات:
أ) تعبر عن المنافسة
ب) تدل على الصداقة والتواصل
ج) توحي بالعداوة
د) تشير للاحترام فقط",ب
لصقه,ذوان وبمعنى الأن ، < ومشتهرة بالحجاز وبالاخص قبيلة جهينة !,Central,"المهمة: اشرح معنى الكلمة في السياق الثقافي.
السؤال: ما الذي يعكسه استخدام كلمة 'لصقه' في الثقافة السعودية?
الخيارات:
أ) التعاون بين الناس
ب) حب الجمال والفن
ج) أهمية الاستعداد
د) قيم الصداقة",ب
داجّ,صفة تطلق على الشخص الذي نفذت نقوده و أصبح لا يملك شيئاً وغالباً ما تضاف كلمة (( هاج )) بعدها للدلالة على سوء الحالة الاقتصادية التي يمر بها الشخص. وقد تطلق على من لم يفلح في دراسته.,Central,"المهمة: تفسير الكلمة بناءً على الثقافة المحلية.
السؤال: ماذا تعبر كلمة 'داجّ' عن حالة الشخص في الثقافة السعودية؟
الخيارات:
أ) حالة من الفخر والثروة
ب) حالة من الفقر والسوء الاقتصادي
ج) حالة من القلق الدراسي
د) حالة من النجاح",ب
دار المحل,مخزن باللهجة الحايلية,Northern,"المهمة: اشرح المعنى الثقافي لكلمة 'دار المحل'.
السؤال: ماذا تعني كلمة 'دار المحل' في الثقافة المحلية؟
الخيارات:
أ) مكان يجتمع فيه الأصدقاء
ب) مخزن للأشياء
ج) بيت جميل
د) مكان للتسوق",ب
داغور,الداغور هو التيس الصغير المكثر للحليب ويشترى عادة لمثل هذا الغرض إن كان ثدي أحدى الماعز ممتلئ فيؤتى به ليشربه,Southern,"المهمة: حدد الأثر الثقافي المرتبط بكلمة 'داغور'.
السؤال: ما هي الأبعاد الثقافية لكلمة 
الخيارات:
أ) يتعلق بكلاب الصيد
ب) يرتبط بالزراعة في الحقول
ج) يستخدم في تربية الماعز
د) يصف الأكلات الشعبية",ج
داية,سيدة تساعد الحوامل وقت الانجاب قديماً، مثل الطبيب حالياً.,Southern,"المهمة: فكر في المعاني الثقافية لكلمة 'داية'.
السؤال: ما هو الدور الثقافي لكلمة 'داية' في المجتمع السعودي القديم؟
الخيارات:
أ) كانت الداية رمزاً للعناية بالأمومة.
ب) كانت الداية مثالاً للحياة الحضرية.
ج) كانت الداية مرتبطة بالتعليم.
د) كانت الداية تعمل كطبيبة بيطرية.",أ
دبج,اي ضرب,Southern,"المهمة: ما هو الفهم الثقافي لكلمة 'دبج' في السياق السعودي؟
السؤال: كلمة 'دبج' تعكس نوعًا من التفاعل في المجتمع السعودي. ما معنى ذلك؟
الخيارات:
أ) تعبر عن العنف
ب) تعبر عن اللعب
ج) تعبر عن الحنان
د) تعبر عن الاحتفال",أ
دبشه,الشخص الغبي الذي يكاد ان لايفقه قولاً,Southern,"المهمة: اختر العبارة التي تفسر الثقافية المرتبطة بكلمة 'دبشه'.
السؤال: ما هي الدلالة الثقافية لكلمة 'دبشه' في اللهجة النجدية؟
الخيارات:
أ) تشير إلى شخص حكيم
ب) تدل على البساطة والغباء
ج) تعني الشجاعة
د) تعبر عن الجمال",ب
دبنجان,كان اهل الحجاز قديما يقولون للطماطم دبنجان,Western,"المهمة: فسر معنى الكلمة في الثقافة الحجازية.
السؤال: ما هو السياق الثقافي لاستخدام كلمة 'دبنجان' في الحجاز؟
الخيارات:
أ) تدل على الرخاء
ب) تعبر عن العادات الزراعية
ج) تشير للغذاء الصحي
د) تعني الفخر بالهوية",ب
دبوس,الدبوس هو شخص يقوم باللسلسة بشكل واعي او غير واعي فهو يلصق بك التهم والدلائل واحيانا يوثقها عليك.,General,"المهمة: حدد أهمية كلمة 'دبوس' في الثقافة السعودية.
السؤال: كيف تعكس كلمة 'دبوس' السلوكيات في المجتمع السعودي؟
الخيارات:
أ) تدل على التضامن والمساعدة
ب) تشير إلى الإدانة والفضح
ج) تعكس الاحترام والمودة
د) تدل على التنافس والتفاخر",ب
دبونة,دبونة : الذي لا يحسن التصرف ويطلق أحيانًا على الشخص الذي يقدم على أمور وهو لا يعرف عواقبها السيئة,Central,"المهمة: بالإشارة إلى الثقافة السعودية، ما الذي ينطوي عليه مصطلح 'دبونة'؟
السؤال: ماذا يشير استخدام كلمة 'دبونة' في السياق الاجتماعي السعودي؟
الخيارات:
أ) إلى الحكمة
ب) إلى التصرفات غير المدروسة
ج) إلى الكرم
د) إلى الصبر",ب
دحدر,تعني اذهب من هنا فليس لك شأن في الموضوع,General,"المهمة: اشرح المعنى الثقافي لكلمة 'دحدر'.
السؤال: ما هو التفسير الثقافي لكلمة 'دحدر' في اللهجة السعودية؟
الخيارات:
أ) تعبير عن الودّ
ب) دعوة للانسحاب من النقاش
ج) علامة على الاحترام
د) شكل من أشكال الترحيب",ب
دحديرة,هو المكان المائل للنزول,Western,"المهمة: اشرح ما قد تعنيه كلمة 'دحديرة' في اللهجة السعودية.
السؤال: ما هي الدلالة الثقافية لكلمة 'دحديرة' في المجتمع السعودي؟
الخيارات:
أ) تشير إلى نوع من الصناعات
ب) تستخدم لوصف مواقع الطبيعة
ج) تعني حفل زفاف
د) ترتبط بأدب الشعر",ب
دُحدِيرَه,أي المكان المتدرج للأسفل .,Western,"المهمة: اشرح كيف تعكس كلمة 'دُحدِيرَه' ثقافة معينة.
السؤال: كيف تعبر كلمة 'دُحدِيرَه' عن ثقافة أهل الحجاز؟
الخيارات:
أ) تعكس سرعة الحياة
ب) تعكس التضاريس الجغرافية
ج) تعكس عادات الضيافة
د) تعكس الاهتمام بالفنون",ب
دِحْقَة,دحقة وتعني زاوية أو أي مكان ضيق جدا تحيط به الجدران من الجانبين . مثلا دولاب في ركن الغرفة بينه وبين الجدار مساحة هذه المساحة يقال عنها دحقة وغالبا تكون مناسبة لإخفاء أي شيء عن الأنظار جاء في لسان العرب : أدحقه الله : باعده عن كل خير وفي حديث علي، رضي الله عنه: سيظهر بعدي عليكم رجل مُنْدَحِقُ البطن أي واسعها كأَنَ جوانِبها قد بَعُد بعضُها من بعض فاتَّسعتْ. وهكذا اكتسبت الكلمة العامية الدحقة ضد معناها الفصيح,Central,"المهمة: اشرح الثقافة المرتبطة بكلمة 'دِحْقَة'.
السؤال: ما هو التفسير الثقافي لكلمة 'دِحْقَة' في المجتمع السعودي؟
الخيارات:
أ) تعبر عن التقاليد القديمة فقط
ب) تشير إلى الأماكن الضيقة التي تُستخدم لإخفاء الأشياء
ج) تُستخدم في الأعياد فقط
د) تعني المساحات المفتوحة",ب
دحلس,دحلس / دحلسة: التملق والمجاملة في الكلام بقصد قضاء حاجة أو طلب.,Western,"المهمة: فسر المعنى الثقافي لكلمة 'دحلس'.
السؤال: كيف تعكس كلمة 'دحلس' ثقافة المجاملة في المجتمع السعودي؟
الخيارات:
أ) تشير إلى أهمية المجاملات في العلاقات الاجتماعية.
ب) لا تعكس أي شيء عن الثقافة.
ج) تدل على التوتر في الكلام.
د) مرتبطة بأفكار الحرية الفردية.",أ
دحلسة,دحلسةعبارة عن اسلوب او وسيلة ترضية للشخص حتى تصل معه للهدف المطلوب,Western,"المهمة: اختر الخيار الذي يفسر معنى 'دحلسة' في السياق الثقافي.
السؤال: كيف تعكس 'دحلسة' ثقافة التواصل في المجتمع السعودي؟
الخيارات:
أ) تعكس أسلوب الشدة.
ب) تعكس أسلوب التفاوض الذكي.
ج) تعكس الفوضى.
د) تعكس أسلوب التهديد.",ب
دَحين,دحين = الآن / حالاً / بعد قليل,Western,"المهمة: وضح التفسير الثقافي لكلمة 'دَحين'.
السؤال: ما هي دلالة كلمة 'دَحين' في الثقافة السعودية؟
الخيارات:
أ) تعبر عن الاستعجال أو الفورية
ب) تعبر عن التأجيل
ج) تعبر عن التذكر
د) تعبر عن الانشغال",أ
دحينا,اي بمعنى : الآن ، حالا,Western,"المهمة: فسر المعنى الثقافي لكلمة 'دحينا' في اللهجة السعودية.
السؤال: لماذا تُستخدم كلمة 'دحينا' بكثرة في الحوارات اليومية في السعودية؟
الخيارات:
أ) لأن السعوديين يحبون التحدث عن المستقبل
ب) لأنها تشير إلى العجلة والسرعة
ج) لأنها تعكس ثقافة العزيمة
د) لأن الحوار السعودي يتطلب التفاوض",ب
دُخْش,كلمة جيزانية بمعنى الزقاق او الممر الضيق في الشوارع والحواري,Southern,"المهمة: اذكر الممارسة الثقافية التي تتعلق بكلمة 'دُخْش'.
السؤال: ما هو السياق الثقافي لكلمة 'دُخْش' في اللهجة السعودية؟
الخيارات:
أ) تشير إلى احتفالات العيد
ب) تدل على الأحياء القديمة والممرات الضيقة
ج) تخص الأسواق الشعبية
د) تشير إلى المراسم الدينية",ب
دراجة,هي مركبة ذو عجرلتين ومقوَدْ ( سيكل ، بسكليت ),Southern,"المهمة: اشرح العلاقة الثقافية لكلمة 'دراجة'.
السؤال: ما هي الثقافة المتعلقة باستخدام 'دراجة' في المجتمع السعودي؟
الخيارات:
أ) رياضة مشهورة
ب) وسيلة نقل فعالة
ج) عادة تقليدية
د) غير مهم",ب
درّاعة,الشماغ ، الغترة ، العمامة,Central,"المهمة: ما القيم الثقافية المرتبطة بكلمة 'درّاعة'؟
السؤال: ماذا تمثل 'درّاعة' في الثقافة السعودية؟
الخيارات:
أ) رمز للكرامة والتقاليد.
ب) نوع من الحلويات.
ج) جزء من تقنية البناء.
د) لا شيء من ذلك.",أ
دَرْبَازان,المسند الملاصق للدَرج ( السلم ) يمكن الاستناد عليه عبر اليدين,Western,"المهمة: اختر التفسير الصحيح لكلمة 'دربازان' في الثقافة.
السؤال: ما هو دور الدربازان في المجتمع السعودي التقليدي؟
الخيارات:
أ) أداة للعب
ب) وسيلة للنقل
ج) مسند يساعد老人
د) قطعة ديكور",ج
درباوي,"الدرباوي (الجمع: درباويّه) هي ظاهرة ثقافية وفكرية وأخلاقية ظهرت بين الشباب السعودي, هناك اختلاف عن أول ظهور لهذه الثقافة. كلمة درباوي جائت من عبارة ""درب الخطر"" وهو إسم منتدى يتجمع فيه هؤلاء الشباب ويشاركون فيه اهتماماتهم, أهمها حبهم للتفحيط حيث يقومون بتبادل مقاطع الفيديو والاتفاق عن مواعيد وأماكن معينة لممارسة هوايتهم. يتميز الدرباوي بصفات شكلية وأخلاقية وثقافية - لغتهم السوقية: عندما يتكلم الدرباوي فإنه يختار كلمات سوقية ليعبر عمّا في خاطرة حتى لو كان يقول قصيدة, ويحب المصطلحات الغربية. - الاندفاع والاستعراض: بنظرهم هذه رجولة أيضا هم يدعمون بعضهم بعضا ويحترمون كل شخص يتصرف مثلهم, وبعض الدرباوية يحمل معه عصا عجره لفرض الهيبة ومنهم من يضعها بداخل شنطة السيارة ويستخدمها عند الحاجة - الكَسْرات: وهو نوع من الأغاني الشعبية ويحبون سماعها مسرعة خصوصا أثناء التفحيط. - الألقاب: يحب الدرباوي أن يعطي لنفسه لقب ويفرح عندما يخاطبه أحد به (أمثلة: الكينغ, العاشق الحزين, أبو زقم, أبو رشاش.) - الإنحراف الأخلاقي: مثل شرب الخمور وتعاطي المخدرات واغتصاب الصبيان ويفعلون كل هذه الأشياء بالسر. - الرغبة بالتوبة: تجد كثير من الدرباويين لديهم تأنيب ضمير وإحساس بالذنب ورغبة بالتوبة, وصار مألوفا أن ترى أحد الدرباويين تحولوا للوعظ الديني - الملابس: الدرباوي يحب اللبس الرسمي (الثوب والشماغ) وهو لا يتحرج بالخروج بملابس المنزل حتى ولو كان يريد الذهاب لمكان فاخر, وهو يفتخر باهماله بمظهره الشخصي ويعتبر الشاب الذي يحرص على نظافة مظهره خكري - البلادة: فهو عالة على أسرته غير مهتم بالدراسة وليس له فائدة وكثيرا منهم يتنمر على أخواته وأمه ويثير المشاكل في المنزل ولذا كثير من العائلات تتركه وشأنه حتى ترتاح من شره",General,"المهمة: وضح ما يقصد به مصطلح 'درباوي'.
السؤال: ما الدلالات الثقافية لكلمة 'درباوي'?
الخيارات:
أ) تشير إلى شخص يتبع القيم التقليدية
ب) تمثل ظاهرة شبابية ترتبط بالتفحيط
ج) تدل على شخص متعلم جدا
د) تعني شخص يعشق الرياضة",ب
