Term,Meaning_of_term,Dialect type,Cultural_Interpretation_question,correct_answer
اسري,هي تفيد الامر بالانصراف او الابتعاد,Western,"المهمة: فكر في المعنى الثقافي لكلمة 'اسري'.
السؤال: ما الذي يعكسه استخدام كلمة 'اسري' في الثقافة السعودية؟
الخيارات:
أ) الاحترام المتبادل
ب) الترحاب
ج) الرغبة في الابتعاد
د) التعاون بين الأفراد",ج
اسطي,اسطي بمعنى اتجرء,Southern,"المهمة: اختر أفضل تفسير لكلمة 'اسطي' في سياقها الثقافي.
السؤال: كيف تعكس كلمة 'اسطي' جزءاً من ثقافة المجتمع السعودي؟
الخيارات:
أ) تعبر عن الشجاعة وتحدي العوائق.
ب) تدل على القوة البدنية.
ج) تعكس الخجل الاجتماعي.
د) ترتبط بالاحترام والتقدير.
الإجابة الصحيحة:",
اشبك,اشبك تعني ماذا بك,Southern,"المهمة: فسر استخدام كلمة 'اشبك' في السياق الاجتماعي.
السؤال: ما هو الدافع وراء استخدام كلمة 'اشبك' في المجالس السعودية؟
الخيارات:
أ) للتعبير عن القلق
ب) لتقديم المساعدة
ج) للتواصل والاستفسار
د) للتعبير عن الحزن",ج
اشحطه,اضربه,Central,"المهمة: افسر المصطلح الثقافي.
السؤال: لماذا يستخدم السكان المحليون في نجد كلمة 'اشحطه'؟
الخيارات:
أ) لأنها تعبر عن القوة
ب) لأنها قد تشير إلى اللعب
ج) لأنها تعكس الثقافة الشرسة
د) لأنها تعني الاهتمام",أ
اشكارك,اشكارك يعني اشدخلك,General,"المهمة: صف معنى كلمة 'اشكارك' في سياق الثقافة السعودية.
السؤال: ما الذي تعبر عنه كلمة 'اشكارك' في الثقافة السعودية؟
الخيارات:
أ) تعبير عن المحبة
ب) تعبير عن القبول
ج) تعبير عن الانزعاج
د) تعبير عن الصداقة",ب
اصبخك,اضربك,Western,"المهمة: اشرح لماذا تُستخدم كلمة 'اصبخك' في اللهجة النجدية.
السؤال: ما الذي يعكسه استخدام كلمة 'اصبخك' في الثقافة النجدية؟
الخيارات:
أ) التهديد
ب) المزاح
ج) التعليم
د) التعاطف",أ
اصحك,هي كلمة تستخدم للزجر و التحذير و يقابلها إياك,Western,"المهمة: قم بشرح دلالة كلمة 'اصحك' في الثقافة السعودية.
السؤال: ما الذي تعكسه كلمة 'اصحك' عن ثقافة التحذير في السعودية؟
الخيارات:
أ) تعكس التوجه نحو التعليم
ب) تعكس القيم الاجتماعية والاحترام
ج) تعكس الفخر بالماضي
د) تعكس أهمية الأسرة",ب
اصه,"تعني ""اصمت""",General,"### نوع السؤال: التعريف الثقافي
- المهمة: اختر إجابة واحدة فقط دون أي ملاحظات إضافية.
- السؤال: ما هي أهمية كلمة ""اصه"" في الثقافة السعودية؟
- الخيارات: 
 A) تعبر عن الضحك 
 B) تدل على الاحترام 
 C) تستخدم لتوجيه الانتباه 
 D) تعبر عن الفرح 
-",C
اطقه,اطقه تعني ( اضربه ) وهي وهي كلمة سعودية ولهجة نجدية لأهل الرياض في الغالب .,Southern,"المهمة: اختر التفسير الثقافي المناسب لكلمة 'اطقه'.
السؤال: ما هو التفسير الثقافي لكلمة 'اطقه' في اللهجة السعودية؟
الخيارات:
أ) تشير إلى فعل عنيف
ب) تعني الصداقة
ج) تدل على الحب
د) تستخدم في المعاملات التجارية",أ
اطلسو,انضرب او انهزم,Western,"المهمة: فسر جملة تحتوي على الكلمة.
السؤال: ماذا تعني عبارة 'اطلسو بثلاثة' في السياق الثقافي؟
الخيارات:
أ) تعني حققوا فوزاً كبيراً
ب) تعني تعرضوا للهزيمة بشكل مدوي
ج) تعني بما أنهم قد تأخروا
د) تعني أن الحظ لم يسعفهم هذا اليوم",ب
اغديك,كلمة تأتي بمثابة كلمة لعلك او طلب ترجي,Central,"المهمة: اختر تفسير كلمة 'اغديك' في الثقافة السعودية.
السؤال: ما هو التفسير الثقافي لكلمة 'اغديك' في اللهجة السعودية؟
الخيارات:
أ) تعبير عن الثقافة الدينية
ب) لغة الحب والرومانسية
ج) تعبير عن الطيبة والكرم
د) تعبير عن الطلب والترجي",د
افحز,تقال اذا اراد الشخص ان يجلس و اراد ان يوسع له بالمجلس,Central,"المهمة: س: ما الذي يعكسه استخدام كلمة 'افحز' في السياق الثقافي السعودي؟
السؤال: ما الذي يوضح تعبير 'افحز' عن التقاليد والعادات في المجالس السعودية؟
الخيارات:
أ) يبرز أهمية الضيافة
ب) يعبر عن المنافسة
ج) يشير إلى القوة
د) يتحدث عن التعليم",أ
افدغ,اي جاهل و سذج,Western,"المهمة: تفسير الكلمة في السياق الثقافي السعودي.
السؤال: لماذا تُستخدم كلمة 'افدغ' في بعض الأحيان للتعبير عن الرأي عن شخص معين؟
الخيارات:
أ) لأنها تعبر عن الاحترام
ب) لأنها تدل على جهل الشخص وسذاجته
ج) لأنه يشير إلى الثراء
د) لأنها تعني الحكمة",ب
افرشك,افرشك بمعنى اضربك او اصفقك,Southern,"المهمة: اختر التفسير الصحيح لكلمة 'افرشك' في الثقافة السعودية.
السؤال: ما الذي تعبر عنه كلمة 'افرشك' في الثقافة الحجازية؟
الخيارات:
أ) التعبير عن القوة
ب) تعبير عن اللطف
ج) تعبير عن الاحترام
د) تعبير عن الحب",أ
اقلط,تفضل بالدخول,Central,"المهمة: فسر أهمية كلمة 'اقلط' في الثقافة السعودية.
السؤال: لماذا تعتبر كلمة 'اقلط' مهمة في الاجتماعات الاجتماعية السعودية؟
الخيارات:
أ) تعبر عن الترحيب والاحترام
ب) تعني الخروج
ج) تستخدم في المدرسة
د) لا تعني شيئا",أ
اكرش,اكرش . يكرش . كرش معناها طرد بشكل عام,Southern,"المهمة: فسر العبارة وفق النوع الثقافي المحيط بالكلمة.
السؤال: كيف تعكس كلمة 'اكرش' الثقافة المجتمعية في نجد؟
الخيارات:
أ) تعبر عن روح الدعابة
ب) تعكس الروح الحماسية عند الأشخاص
ج) تشير لطبيعة العلاقات الأسرية
د) تعبر عن أسلوب الحياة المتنقل",ج
اكعمه,معنى اكعمه اي غطاه وقيده,Western,"المهمة: اشرح كيف تعكس الكلمة 'اكعمه' ثقافة المنطقة الحجازية.
السؤال: ما هو المعنى الثقافي لكلمة 'اكعمه' في اللهجة الحجازية؟
الخيارات:
أ) تعبر عن السيطرة والهيمنة
ب) تشير إلى الصداقة والود
ج) تدل على الاحترام والتقدير
د) تعكس الحب والرومانسية",أ
الأثافي,أحجار توضع داخل النار يوضع عليها القدر او الخبز,Western,"المهمة: ما هي دلالة كلمة 'الأثافي' في الثقافة الحجازية؟
السؤال: ما هي الفكرة التي تعكسها كلمة 'الأثافي' في الثقافة الحجازية؟
الخيارات:
أ) التقليد في الطهي
ب) خاصية اجتماعية
ج) نمط معماري
د) نوع من الأغاني",أ
التفاحة الفاسدة,عبارة تطلق على الشخص الذي يفسد البقية من الناس . اصل هذا المصطلح كان يقال في المدارس للطلاب ، فيقول الاستاذ للطلاب: لو فيه تفاحة وحدة فاسده وفيها دود ، وحطيتها على سلة مليئة بالتفاح النظيف فرح تصير كل التفاحات فاسدة. في نظرية اللعبة هناك شواهد لصحة هذا القول في لعبة.,General,"المهمة: وضح الفهم الثقافي للعبارة.
السؤال: كيف تعكس العبارة 'التفاحة الفاسدة' القيم الاجتماعية في الثقافة السعودية؟
الخيارات:
أ) تعبر عن أهمية الفرد في المجتمع
ب) تعبر عن العالميّة والاختلاف
ج) تشير إلى ضرورة التوازن الاجتماعي
د) تعكس أهمية التعليم",أ
الحوطة,الحوطة وهي مدينة بالحوطة يصفون الناس الدلوخ والاغبياء ب أنت من الحوطة ؟ اي شخص من اهل نجد يصف اي شخص غبي او دلخ ب انت من الحوطة ؟ ك سب له,Central,"المهمة: صف كيف تعكس كلمة 'الحوطة' جزءاً من الثقافة الشعبية في السعودية.
السؤال: ما هو التفسير الثقافي لكلمة 'الحوطة' في المجتمع السعودي؟
الخيارات:
أ) تعبر عن التدني في التعليم
ب) تعكس رؤية سلبية عن الثقافة
ج) تشير إلى الطيبة والبراءة
د) تحتوي على طابع فكاهي تم استخدامه بشكل عام",د
الخد,اي الأرض مثال : حط (المركى/ السطل / الزولية / إلخ.) على الخد,Western,"المهمة: فسر العبارة التالية.
السؤال: لماذا تُستخدم الكلمة 'الخد' في معنى الأرض في اللهجة النجدية؟
الخيارات:
أ) لأن الأرض تكون كبيرة
ب) لأننا نضع الأشياء على الأرض
ج) لأنها جزء من الثقافة الشعبية
د) لأنه مرتبط بالزراعة",ج
الدح,الدح هو الطعام الحار جداً وفي بعض اللهجات كل ماهو مرغوب وجديد وصعب المنال,General,"المهمة: فقرة قصيرة ينبغي معرفتها.
السؤال: ما هو المعنى الثقافي لكلمة 'الدح' في اللهجة السعودية؟
الخيارات:
أ) الطعام المرغوب والشراب.
ب) تعبير عن الكسل.
ج) شيء يخص الحيوانات.
د) واقعة تاريخية.",أ
الدلخ,الدلخ تأتي بمعنى الشخص الغبي,Western,"المهمة: اشرح معنى الكلمة في سياق ثقافي.
السؤال: ما هو التفسير الثقافي لكلمة 'الدلخ' في المجتمع السعودي؟
الخيارات:
أ) تعبر عن الإيجابية في التفكير
ب) تعكس مستوى من الغباء أو عدم الفهم
ج) تعبر عن الفخر والاعتزاز
د) تشير إلى الحرفية والمهارة",ب
الزبدة,يعني المهم,General,"المهمة: اشرح كيف تعكس كلمة 'الزبدة' الثقافة السعودية.
السؤال: ما هو التفسير الثقافي لكلمة 'الزبدة' في اللهجة السعودية؟
الخيارات:
أ) تعبر عن أهمية تواصل الأفكار
ب) تعبر عن عدم اهتمام الناس
ج) تعكس قلة التعبير اللغوي
د) تستخدم للدعوة للاسترخاء",أ
اقشعه,اقلعه او انزعه,Western,"المهمة: اختر التفسير الصحيح لكلمة 'اقشعه' في الثقافة السعودية.
السؤال: كيف تعكس كلمة 'اقشعه' الثقافة السعودية؟
الخيارات:
أ) تعبير عن الزراعة والتعامل مع النباتات
ب) تعبير عن السعادة
ج) تعبير عن الضيافة
د) تعبير عن السفر",أ
الطَفرِية,قطعة بلاستيكية مستطيلة و مسطحة الشكل لها مكانين من على الجنب لحملها وتستخدم لوضع الأكل عليها ثم حملها .,Western,"المهمة: ما هو التفسير الثقافي لكلمة 'الطَفرِية' في اللهجة السعودية؟
السؤال: ماذا تعني كلمة 'الطَفرِية' في الثقافة السعودية؟
الخيارات:
أ) نوع من الزينة
ب) وسيلة لحمل الطعام والمشروبات
ج) نوع من الملابس
د) لعبة أطفال",ب
الطواقي,الطواقي يطلق على فريق جحا,Western,"المهمة: ما هو المعنى الثقافي لكلمة 'الطواقي' في المجتمع السعودي؟
السؤال: ما الذي يدل عليه تعبير 'الطواقي' في الثقافة السعودية؟
الخيارات:
أ) يدل على روح التعاون
ب) يشير إلى الحشمة
ج) يتعلق بألعاب الطفولة
د) يعبر عن المنافسة",أ
العْمَرْ,العمر بإسكان العين وفتح الميم، شهر محرم ويسميه بعض الناس عاشور ايضا.,Southern,"### نوع السؤال: التعريف الثقافي
المهمة: اختر الإجابة الصحيحة التي توضح الأهمية الثقافية لكلمة ""العْمَرْ"".
السؤال: ما هي الدلالة الثقافية لكلمة ""العْمَرْ"" في المجتمع النجدية؟
الخيارات:
A) يرتبط بموسم الحج 
B) يرتبط بصيام عاشوراء 
C) يشير إلى بداية العام الهجري 
D) يدل على الإحتفال بالعيد",B
العورة,العورة هي كل عيب او او كل شي يعطي شعور العار وهي كلمة تستخدم في نجد بالسعودية لوصف مابين السرة والركبة للرجال والعورة نوعين مغلظه ومخففه في الاسلام المغلظه اي تنقض الوضوء اما المخففة فلاتنقض الوضوء ابداً بالنسبه للرجل المخففه هي السرة و الركبه والفخذ والخصيتين اما المغلظه هو العضو الذكري الطويل والدبر وهذا عند اهل السنه والشيعه ايضا الخصيتين لاتنقض الوضوء ابداً واذا كانت هذه معلومه جديده لك لاتبخل في وضع لايك على المفرده,Central,"المهمة: حدد تفسير 'العورة' في الثقافة السعودية.
السؤال: ما هو التفسير الثقافي الرئيسي لكلمة 'العورة' في المجتمع السعودي؟
الخيارات:
أ) تعبر عن القيم الاجتماعية المرتبطة بالستر والحياء
ب) تعبر عن الفخر والاعتزاز
ج) تعبر عن الملابس الجديدة
د) تعبر عن الأزياء المختارة",أ
الغما,"فصيحة ()، سقف البيت.  . لسان العرب، ""والغُّما: سَقْفُ البيت""",Central,"المهمة: اشرح كيف يعكس استخدام كلمة 'الغما' جزءًا من الثقافة السعودية.
السؤال: لماذا تعتبر كلمة 'الغما' مهمة في الثقافة السعودية؟
الخيارات:
أ) تعكس أسلوب البناء التقليدي
ب) تشير إلى أنواع الأطعمة
ج) تُستخدم في الموسيقى
د) ترتبط بالأزياء التقليدية",أ
فروة,فروة رجالية تلبس للتدفئة,Western,"المهمة: فسر معنى كلمة 'فروة' في السياق الثقافي.
السؤال: ما هو الدلالة الثقافية لكلمة 'فروة' في المجتمع السعودي؟
الخيارات:
أ) علامة على الفقر
ب) تعبير عن الثقافة البدوية
ج) تردد في الجبال
د) لا يحمل أي دلالة",ب
اذلف,بمعنى اغرب عن وجهي وغالبا ما تقال عندما يضجر الشخص من كلام شخصا آخر له وأيضا هناك كلمات بنفس المعنى مثل: انقلع,Central,"المهمة: اشرح الدلالة الثقافية لكلمة 'اذلف'.
السؤال: ما الدلالة الثقافية لكلمة 'اذلف' في اللهجة السعودية؟
الخيارات:
أ) تعبير عن الود
ب) تعبير عن النفور
ج) تعبير عن الحماسة
د) تعبير عن الدعم",ب
ارع,ارع او ارعى او راع ، في لهجة أهل تبوك تعني ؛ أنظر,Northern,"المهمة: اشرح الفهم الثقافي لكلمة 'ارع'.
السؤال: كيف تعكس كلمة 'ارع' الثقافة المحلية لأهالي تبوك؟
الخيارات:
أ) تعكس عدم الاحترام
ب) تعكس الاهتمام والملاحظة
ج) تعكس العزلة
د) تعكس الفخر",ب
المدريهة,لعبة,Western,"### نوع السؤال: التعريف الثقافي
- المهمة: اختر الإجابة الصحيحة
- السؤال: ما هي الأهمية الثقافية لكلمة ""المدريهة"" في السياق الحجازي؟
- الخيارات:
 A) تجسد روح التعاون بين الأطفال. 
 B) تشير إلى الأطعمة الشعبية. 
 C) تعبير عن الفنون التشكيلية. 
 D) تمثل وسائل النقل القديمة. 
-",A
المرزبه,المطرقة الكبيره وهي ايضا كلمه فصيحه ومن يستخدمها هم اهل (الاحساء (هجر)),Western,"المهمة: اكتب تفسيرا ثقافيا لكلمة 'المرزبه'.
السؤال: ما significance 'المرزبه' في الثقافة السعودية؟
الخيارات:
أ) تستخدم طقوس خاصة
ب) تدل على الشجاعة
ج) تستخدم في الأعمال الحرفية
د) غير متاح",ج
الهيضة,الهِيضَة ، تَهْيِيض ، تِهَيَّضُوا ، هَاضَت ، تِهيّض ، هَيَّضنا. الهيضة: هي الشيء الاكثر رواجا وحماسة الآن. وفلان متهيّض : فلان متحمس ومتهيِّج بشكل قوي جدًا.,Southern,"المهمة: اشرح المعنى الثقافي للكلمة.
السؤال: كيف يعكس استخدام كلمة 'الهيضة' في اللهجة السعودية روح المجتمع السعودي؟
الخيارات:
أ) يزيد من فخر القبائل
ب) يمثل الحماسة والانخراط في الأنشطة الاجتماعية
ج) يشير إلى الخمول الاجتماعي
د) يعكس السلبية في التعامل مع الآخرين",ب
الويسة,كلمة حسائية يقصد بها نوع من الخُرُق والأقمشة القديمة البالية تستخدم في تنظيف المطبخ والمجلى والدواليب,General,"المهمة: اشرح استخدام كلمة 'الويسة' في الثقافة السعودية.
السؤال: ترتبط كلمة 'الويسة' في الثقافة السعودية باستخدام __________.
الخيارات:
أ) تكنولوجيا حديثة
ب) أدوات تقليدية منزلية
ج) ملابس تقليدية
د) أدوات الزراعة",ب
امحق,لوصف حال ميؤس منه !,Western,"### نوع السؤال: التعريف الثقافي
Task: Choose only one answer without any additional notes. 
Question: ما هي الدلالة الثقافية لكلمة ""امحق"" في اللهجة النجدية؟ 
Options: 
A) تعبر عن الفرح والسرور 
B) تشير إلى حالة من اليأس أو الإحباط 
C) تدل على الحماس والعاطفة 
D) تستخدم كتحية بين الأصدقاء 
Correct answer: B",
امرشك,امرشك : اخدشك وتستخدم للتعبير عن النية للضرب. وبالفصحى : المرش هو الحك الخفيف باطراف الاظافر,Southern,"المهمة: حدد التفسير الثقافي لكلمة 'امرشك'.
السؤال: ما الدور الثقافي لكلمة 'امرشك' في المجتمع السعودي؟
الخيارات:
أ) تعبر عن التحية
ب) تعكس ثقافة التحذير
ج) تشير إلى الكرم
د) تعبر عن الفرح",ب
امغل,بمعنى القرص او القبص وتكون حاارّه على الجلد,Southern,"المهمة: تفسير الاستخدام الثقافي لكلمة 'امغل'.
السؤال: ما هو المعنى الثقافي لكلمة 'امغل' في اللهجة السعودية؟
الخيارات:
أ) تعبير عن اللطف
ب) إشارة إلى الألم الناتج عن حرارة
ج) وصف لجمال الطبيعة
د) كلمة تستخدم في الشعر",ب
انت توحي,كلمة تعبر عن سماع شيء,Central,"المهمة: بين معنى كلمة 'انت توحي' في السياق الثقافي.
السؤال: كيف تعكس عبارة 'انت توحي' الثقافة السعودية؟
الخيارات:
أ) تعبر عن رغبة في التغيير
ب) تشير إلى التواصل العائلي
ج) تدل على الاعتماد على الأصدقاء
د) تتعلق بالعمل الجماعي",ب
انتخشوا مريَّك,عندما يتم استخراج المريء من الجسد وانتشاله بقوة.,Western,"المهمة: اشرح دلالة العبارة في الثقافة السعودية.
السؤال: ما هو المعنى الثقافي لعبارة 'انتخشوا مريَّك'؟
الخيارات:
أ) تعبر عن القوة واجتياز المصاعب.
ب) تعبر عن الأمل في المستقبل.
ج) تدل على التهاون والراحة.
د) تعبر عن الود والمحبة.",أ
انتسلع,انتسلع، وهي بالاصل (انقلع) وتعني اغرب عن وجهي وهي كلمة فصيحه وفي الاصل تعني انتزع لكن معناها تغير بلهجة شمال نجد,Central,"### نوع السؤال: التعريف الثقافي
المهمة: اختر الإجابة الصحيحة فقط دون أي ملاحظات إضافية. 
السؤال: ما الدلالة الثقافية لكلمة ""انتسلع"" في لهجة شمال نجد؟ 
الخيارات: 
A) تعبير عن الاحترام 
B) تعبير عن الود 
C) تعبير عن الابتعاد 
D) تعبير عن الصداقة",C
انثبر,أي اسكت، وغالبا مايقولها الشخص وهو في حالة غضب.,Western,"المهمة: فسر استخدام كلمة 'انثبر' في الثقافة السعودية.
السؤال: لماذا تعتبر كلمة 'انثبر' تعبيراً شائعاً في اللهجة السعودية؟
الخيارات:
أ) لأنها تعبر عن الدعوة للحوار
ب) لأن استخدامها يعبر عن الغضب
ج) لأنها تعبر عن الحذر
د) لأن الناس يحبون الحديث",ب
انجز,للذكر انجز وللانثى انجزي اي استعجل ، استعجلي ، قم بعمل الشئ بسرعه,Central,"المهمة: حدد ما يعكسه استخدام كلمة 'انجز' في الثقافة السعودية.
السؤال: ما هي الدلالة الثقافية التي يحملها استخدام كلمة 'انجز' في اللهجة السعودية؟
الخيارات:
أ) إشارة إلى البعد عن العمل
ب) دلالة على أهمية الجد والاجتهاد
ج) تعبير عن البطء في الإنجاز
د) لا شيء مما سبق",ب
انخرش,خاف، بسبب المفأجاة.,General,"المهمة: تفسير دلالة كلمة 'انخرش' في السياق الثقافي.
السؤال: ماذا تعني كلمة 'انخرش' في المجتمع السعودي؟
الخيارات:
أ) تعني الخوف من المفاجآت
ب) تعني الفرح بحدث سعيد
ج) تعني عدم الاهتمام
د) تعني الاسترخاء",أ
انسلق,هذة الكلمة تقال لشخص الذي ينزل في البئر او ينزل من شئ عالي بحبال,Central,"المهمة: حدد كيف تعكس كلمة 'انسلق' جزء من الثقافة السعودية.
السؤال: كلمة 'انسلق' تعكس تراث اللهجة النجدية في السعودية لأنه يشير إلى _________.
الخيارات:
أ) أسلوب الزراعة
ب) تقنيات الصيد
ج) طرق الوصول إلى المياه
د) العادات الاجتماعية",ج
انفقع,اِنْفِقَعْ : انفجر,Central,"المهمة: اشرح معنى الكلمة في السياق الثقافي.
السؤال: ما الدلالة الثقافية لكلمة 'انفقع' في اللهجة السعودية؟
الخيارات:
أ) تشير إلى حدث مفاجئ
ب) تشير إلى نهاية شيء
ج) تشير إلى حدوث خطأ
د) تشير إلى فرحة
الإجابة الصحيحة:",
