Term,Meaning_of_term,Dialect type,Cultural_Interpretation_question,correct_answer
كُب، كب,كُب الموية، كُب الشاي: بمعنى (صُب، أسكب، أفرق) الماء أو الشاي كب = سكب، صب، فرغ الكلمة في اصلها فعل ماخوذ من كلمة كوب (وعاء) وهي صب الماء أو أي سائل من إناء كبير في وعاء صغير كالكوب,Western,"المهمة: ما الذي يفسر استخدام كلمة 'كُب' في اللهجة السعودية؟
السؤال: لماذا قد تُستخدم كلمة 'كُب' في الحياة اليومية في السعودية؟
الخيارات:
أ) لأنها تعبر عن الصب أو السكب
ب) لأنها تعني الاختباء
ج) لأنها تشير إلى اللعب
د) لأنها تعني التنظيف",أ
كبّاس,كباس هو الصنبور أو الحنفيه,Southern,"المهمة: اختر التفسير الصحيح للكلمة في سياق الثقافة السعودية.
السؤال: ما معنى كلمة 'كبّاس' في الثقافة السعودية؟
الخيارات:
أ) تشير للمياه الجارية من الصنبور
ب) تعني نوع من الألواح الكهربائية
ج) تعبر عن الخبز التقليدي
د) تدل على نوع من الزهور",أ
كبده,كِبْدَه ، كَبَادَه ، كِبَد (جمع) صفة تطلق على الشخص الذي يصنع جوًا اجتماعيًا بغيضًا لدرجة انه يحوم الكبد ويرفع المرارة ويثير الحنق.,Western,"المهمة: اختر الجملة التي تتضمن تفسيرًا للمعنى الثقافي لكلمة 'كبده'.
السؤال: كيف تُفهم كلمة 'كبده' في الثقافة السعودية؟
الخيارات:
أ) تعبر عن شخص بذيء.
ب) تُستخدم للتعبير عن شخص محب لعمل الخير.
ج) تدل على شخص يتحدث بشكل لطيف.
د) تعني شخص اجتماعي ويسهل التعامل معه.",أ
كَبَرِّتَة,شرشف أو قطعة سميكة من القماش توضع تحت الملابس اثناء عملية الكي بالمكواة. يتميز نسيج الكبرتة بمقاومته الشديدة لدرجات الحرارة المرتفعة، لذلك من النادر احتراقه بفعل حرارة المكواة.,Western,"المهمة: فسر معنى الكلمة في السياق الثقافي.
السؤال: لماذا يُعتبر استخدام الكبرتة مهمًا في حياة الناس؟
الخيارات:
أ) لأنها تسهل الكي وتحافظ على الملابس
ب) لأن لها تاريخ عريق
ج) لأنها تستخدم في الطهي
د) لأنها وسيلة للتسلية",أ
كبك منه,سيبك منه، اتركه عنك,Western,"المهمة: حدد ما يعكسه مصطلح 'كبك منه' في الثقافة السعودية.
السؤال: ماذا يعني المصطلح 'كبك منه' في السياق الاجتماعي؟
الخيارات:
أ) يرتبط بالتجاهل والسيطرة
ب) يعكس اهتماماً وتقارب
ج) يدل على المسؤولية
د) لا يعكس أي شيء",أ
كَبّوس,تعني قُبّعة,Central,"المهمة: وضح المعنى الثقافي لكلمة 'كَبّوس'.
السؤال: ما أهمية ارتداء 'كَبّوس' في الثقافة النجدية؟
الخيارات:
أ) يدل على الاحترام والمظهر الجيد.
ب) يستخدم فقط في الأحداث الرياضية.
ج) لا يوجد له أهمية.
د) يرتديه الأطفال فقط.",أ
كَتْكوت,صفة بمعنى (مَليح أو لطيف) والجمع كَتاكيت,Western,"المهمة: قم بشرح معنى كلمة 'كَتْكوت' في الثقافة المحلية.
السؤال: ما هو التفسير الثقافي لكلمة 'كَتْكوت' في اللهجة السعودية؟
الخيارات:
أ) تعني شخص جميل أو لطيف
ب) تعني شيء سيء
ج) تعني شخص قوي
د) تعني شخص غريب",أ
كِذيَهْ,كذيه تعني زي كذا أو مثل هذا,General,"المهمة: أي مما يلي يصف استخدام كلمة 'كِذيَهْ' في الثقافة السعودية؟
السؤال: ما هو السياق الثقافي الذي يُستخدم فيه المصطلح 'كِذيَهْ'؟
الخيارات:
أ) في الحديث عن الطبيعة
ب) في العادات اليومية
ج) في الفنون
د) في التعليم",ب
كراويتا,وهو كرسي مرتفع مصنوع من الخشب أو الحديد يستطيع اكثر من شخص الجلوس عليه. غالبا ما يوضع في مكان عام ليجتمع الأصدقاء. و مرادفه المركاز.,Western,"المهمة: فسر العبارة التالية في سياقها الثقافي.
السؤال: ما هي الدلالة الثقافية لكلمة 'كراويتا' في المجتمعات السعودية؟
الخيارات:
أ) مكان يرمز للاجتماع والتواصل.
ب) رمز للأثاث الفاخر.
ج) إشارة للتراث الهندسي.
د) محطة لوسائل النقل.",أ
كُرتة,ثوب نسائي,Western,"المهمة: فسر معنى الكلمة 'كُرتة' في ثقافتنا.
السؤال: ما هي دلالة كلمة 'كُرتة' في الثقافة السعودية؟
الخيارات:
أ) تعبر عن التراث والأسلوب الجمالي في الأزياء
ب) تشير إلى نوعية معينة من الطعام
ج) تعني شيئًا علميًا
د) تتعلق بالأدوات المنزلية",أ
كرته,هو فستان لبسوه اجدادنا و يميزه عن غيره بوجود وسط ليس كباقي الثياب .,Southern,"المهمة: تفسير الثقافة المرتبطة بالكلمة.
السؤال: ما الذي تعبر عنه الكلمة 'كرته' في الثقافة الحجازية؟
الخيارات:
أ) طريقة الطبخ التقليدي
ب) نوع من الحلي
ج) فستان يحتوي على تصميم مميز
د) طقوس احتفالية",ج
كرتون,تقال للسيارت الجديدة الغير صلبة,Western,"المهمة: اختر التفسير الثقافي لكلمة 'كرتون'.
السؤال: لماذا يستخدم الناس في بعض المناطق كلمة 'كرتون' للإشارة إلى السيارات الجديدة؟
الخيارات:
أ) لأن السيارة دائمة التشكيل
ب) لأن السيارة خفيفة الوزن وغير قوية كالمعدن
ج) لأنها مصنوعة من الكرتون
د) لأنها تستطيع الطيران",ب
كرسوع,صفة تطلق على الشخص القوي جسديا (خصوصًا اذا كان نحيل وغير ظاهر عليه القوة),Southern,"المهمة: فسر المعنى الثقافي للكلمة 'كرسوع'.
السؤال: ما هو المعنى الثقافي لكلمة 'كرسوع' في اللهجة الحجازية؟
الخيارات:
أ) يصف شخصًا قويًا بشكل غير مرئي
ب) يدلل على شخص ضعيف
ج) يشير إلى الفخر والثقة
د) يستخدم لوصف الجمال",أ
كرفسة,طريقة للجلوس.,Western,"المهمة: اختر التفسير الثقافي لكلمة 'كرفسة'.
السؤال: ما الذي تشير إليه كلمة 'كرفسة' في الثقافة الحجازية؟
الخيارات:
أ) جلسة غير رسمية.
ب) مشروب تقليدي.
ج) نوع من الأكلات.
د) أسلوب حياة.",أ
كركبة,تطلق على الاشياء المتناثرة او بمعنى اصح ( عدم الترتيب ),Western,"المهمة: اختر الخيار الذي يصف الثقافة المرتبطة بكلمة 'كركبة'.
السؤال: ما الذي تعبر عنه كلمة 'كركبة' في الثقافة الحجازية؟
الخيارات:
أ) النظام والترتيب.
ب) العشوائية وعدم التنظيم.
ج) الاحترام والتهذيب.
د) العمل الجماعي.",ب
كركون,السجن,Southern,"المهمة: اشرح ما تعنيه كلمة 'كركون' في الثقافة السعودية.
السؤال: ما الذي يدل عليه استخدام كلمة 'كركون' في المجتمع السعودي؟
الخيارات:
أ) مكان للفقراء
ب) عمل جيد
ج) اعتقال أو سجن
د) مناسبة اجتماعية",ج
كْرِه,كره. بتسكين الكاف والهاء، و كسر الراء. كلمة نجدية وتعني: كم أكرهك ياهذا. وتقال عادة عندما يطفح الكيل.,Central,"المهمة: فسر استخدام كلمة 'كْرِه' في ثقافة نجد.
السؤال: ما الذي تعكسه كلمة 'كْرِه' في الثقافة النجدية؟
الخيارات:
أ) تعبر عن الفرح
ب) تشير إلى الغضب والاستياء
ج) تعني التعاون
د) تعبر عن الحب",ب
كروك,لعبة بين الأطفال الصغار ، واحد يغض ابصاره و يعدّ إلى العشرة (واحد،اثنان،.)و الأطفال الآخرون يختفون في أماكن مختلفة ، و ذلك الطفل يبدأ بالبحث عن الآخرين .,General,"المهمة: ناقش التفسير الثقافي للكلمة.
السؤال: ما الذي تعبر عنه كلمة 'كروك' في الثقافة السعودية؟
الخيارات:
أ) يمثل فرصة للاختباء والتنافس.
ب) يشير إلى نوع من الطعام.
ج) يمثل مكان للترفيه للكبار.
د) يتعلق بالعطلات فقط.",أ
كروكا,كروكا يعني عبد اسود,Western,"المهمة: فسر الاستخدام الثقافي لكلمة 'كروكا'.
السؤال: لماذا تُستخدم كلمة 'كروكا' في الحجاز؟
الخيارات:
أ) للإشارة إلى العمال.
ب) للإشارة إلى الأصدقاء.
ج) للإشارة إلى العبيد.
د) للإشارة إلى الحيوانات.",ج
كريبا,الشخص شديد السواد,Central,"المهمة: اشرح مدى تأثير كلمة 'كريبا' في الثقافة النجدية.
السؤال: ما الذي تعكسه كلمة 'كريبا' عن الثقافة النجدية؟
الخيارات:
أ) التركيز على الجمال
ب) التنوع الثقافي
ج) العنصرية والتمييز
د) التقدير الشخصي",ج
كريسي,و تعني المضاربة / العراك بلغة جدة العامية ، و سميت كذلك لإستخدام الكراسي فيها بعض الاحيان .,Western,"المهمة: اشرح أهمية كلمة 'كريسي' في الثقافة الحجازية.
السؤال: كيف تعكس كلمة 'كريسي' عادات وتقاليد المجتمع الحجازي؟
الخيارات:
أ) تعبر عن التحضير للطعام.
ب) ترمز للعنف في الأحياء.
ج) تشير للترابط الاجتماعي.
د) ليست لها دلالة ثقافية.",ب
كس بيرك,يعني مالي دخل بك ماني همك ماتهمني,General,"المهمة: تفسير معنى العبارة في الثقافة السعودية.
السؤال: ما الذي يعكسه استخدام عبارة 'كس بيرك' في الثقافة السعودية؟
الخيارات:
أ) الاحترام
ب) الاستهانة بالآخرين
ج) المشاركة في النقاشات
د) الكرم",ب
كَسْحَة,تطلق على من تحدث بخبر جديد أو حاول إلقاء دعابة على من حوله بشكل منفعل ولكنه يتفاجأ بعدم تجاوب من حوله لما قاله.,Western,"المهمة: وضح كيف تعكس كلمة 'كَسْحَة' جزءاً من الثقافة المحلية.
السؤال: لماذا تعكس كلمة 'كَسْحَة' روح الدعابة والتفاعل الاجتماعي؟
الخيارات:
أ) لأنها تشير إلى الجدّية.
ب) لأنها تتعلق بالتفاعل الاجتماعي.
ج) لأنها توحي بالفشل.
د) لأنها تعني الفرح.",ب
كش,تستخدم الكلمه مع رفع الكف وتفريج الاصابع في مقابل الشخص المراد ذمه دليل على عدم الاعجاب او الاستنكار والاستهزاء,General,"المهمة: اختر التفسير الثقافي المناسب لكلمة 'كش'.
السؤال: ما هو التفسير الثقافي لكلمة 'كش' في المجتمع السعودي؟
الخيارات:
أ) يستخدم للتعبير عن الحب
ب) يستخدم للإشارة إلى عدم الإعجاب أو الاستنكار
ج) يستخدم في الترحيب
د) يستخدم للإشادة بالآخرين",ب
كشمة,كشمة اي نظارة,Western,"المهمة: حدد العوامل الثقافية المرتبطة بكلمة 'كشمة'.
السؤال: ما هي الأهمية الثقافية لكلمة 'كشمة' في السعودية؟
الخيارات:
أ) تعبر عن أهمية التعليم
ب) تشير لاستخدام النظارات في الحياة اليومية
ج) تعكس موضة الملابس
د) تعني أدوات الزراعة",ب
كصمه,كلمة تقال ل الجزء من الشي,Southern,"المهمة: وضح المعنى الثقافي لكلمة 'كصمه'.
السؤال: ما هو التفسير الثقافي لكلمة 'كصمه' في اللهجة السعودية؟
الخيارات:
أ) يعكس شهامة البدو
ب) يشير إلى الاحترام
ج) يدل على تبادل الأشياء
د) يدل على الترفيه
الإجابة الصحيحة:",
كعروم,هو الاسم الذي تطلق امي على الفيش الكهربائي ذو المخارج المتعددة,General,"المهمة: فسر الكلمة 'كعروم' في السياق الثقافي السعودي.
السؤال: ما هو السياق الثقافي الذي تُستخدم فيه كلمة 'كعروم'؟
الخيارات:
أ) تستخدم في دلالة على الفتوح الإسلامية
ب) مرتبطة بالتكنولوجيا والكهرباء في الحياة اليومية
ج) تعبير عن العلاقة الأسرية
د) تدل على الأكلات الشعبية",ب
كفت . الكفت,كفت . الكفت هو الشي الصعب او المستحيل او الذي يصعب فعله,Western,"المهمة: اختر الجواب الصحيح الذي يفسر استخدام الكلمة في الثقافة السعودية.
السؤال: كيف تعكس كلمة 'الكفت' الثقافة المحلية؟
الخيارات:
أ) تشير إلى التساهل
ب) تعبر عن التحديات الصعبة
ج) تدل على المرح والانبساط
د) تعكس التعاون",ب
كفكيرة,"وعاء غلي الماء , غالباً يكون لونه فضي ويصفر اذا غلت الموية وفارت",Western,"المهمة: فهم الثقافة المرتبطة بكلمة 'كفكيرة'.
السؤال: ماذا تعكس كلمة 'كفكيرة' عن الثقافات المحلية؟
الخيارات:
أ) تعكس أهمية الشاي والقهوة في المجتمع
ب) تعكس أسلوب الحياة غير الصحي
ج) تعكس استخدام التكنولوجيا الحديثة
د) تعكس العادات الاجتماعية في المناسبات",أ
كل تبن,تعني أسكت ولا تتكلم . والتبن هو الشسمه,Central,"المهمة: وضّح معنى 'كل تبن' في السياق الثقافي.
السؤال: كيف تُستخدم عبارة 'كل تبن' في الثقافة السعودية؟
الخيارات:
أ) تعبير عن الحب
ب) دعوة للتحدث
ج) تعبير عن طلب السكوت
د) تعبير عن الفرح",ج
كل من الخيبه,كلمه معنه كل تراب,Western,"المهمة: حدد ما تعكسه عبارة 'كل من الخيبه' في الثقافة السعودية.
السؤال: ما الذي تعبر عنه عبارة 'كل من الخيبه' في السياق الثقافي السعودي؟
الخيارات:
أ) الجمال والشجاعة
ب) الفقر والبساطة
ج) الربط بالأرض والانتماء
د) الاختلافات العرقية",ج
كل هوا,معناه كل هوا السكوت,Western,"المهمة: فسر المعنى الثقافي لعبارة 'كل هوا'.
السؤال: ما الذي يعكسه استعمال عبارة 'كل هوا' في الثقافة السعودية؟
الخيارات:
أ) التعبير عن الصمت
ب) كثرة الكلام
ج) الرغبة في الانقطاع
د) التقدير للحديث",أ
كلب بوليسي,هي صفة تطلق على الشخص الذي يحب ان تطبق العقوبات على الناس الذين خالفوا النظام ، وبغض النظر عن اهداف النظام او القانون( التي قد تكون هدفها مجرد تحييد وتقليل عدد المخالفات وليس منعها تمامًا)، وحتى وان كان النظام او المخالفة لا تضره هو شخصياً او تضر غيره، فهو ينتشي على فكرة انه هو من تسبب في تطبيق النظام بشكل دائم وعلى الأخرين. وقد يكون الكلب الپوليسي شرطي الاخلاق ايضاً .,Central,"المهمة: فسر الجملة بشكل أدق.
السؤال: ما الذي يعكسه وصف 'كلب بوليسي' عن ثقافة المجتمع؟
الخيارات:
أ) الاحترام للقانون
ب) الفوضى في تطبيق العدالة
ج) حب السيطرة
د) التسامح مع المخالفات",ج
كلّج,اي لم ينطق الكلمه بشكل صحيح,Central,"المهمة: فسر ما تعبر عنه كلمة 'كلّج' في اللهجة السعودية.
السؤال: ما هي دلالة كلمة 'كلّج' في الثقافة السعودية؟
الخيارات:
أ) تعبر عن السعادة
ب) تدل على عدم النطق الصحيح للكلمات
ج) تشير إلى الكرم
د) تعني النجاح",ب
كلجة,لغة غير صحيحة . كلام مكسر.,Western,"المهمة: فسر الكلمة في سياقها الثقافي.
السؤال: كيف تعبر كلمة 'كلجة' عن الثقافة الحجازية؟
الخيارات:
أ) تعبر عن التحدث بشكل غير سليم
ب) تشير إلى الشعراء
ج) تعبر عن الفصحى
د) تشير إلى التخاطب السليم",أ
كلجه,هو كثرة الخطأ بنطق الكلمات .,Southern,"المهمة: اختر التفسير الثقافي لكلمة 'كلجه'.
السؤال: ماذا تعني كلمة 'كلجه' في المجتمع السعودي؟
الخيارات:
أ) الانتقاد بطريقة إيجابية
ب) التعبير عن الاحتقار بسبب النطق الخاطئ
ج) احترام العادات
د) مساعدة الآخرين",ب
كلفسي,"كلفسي كلمة قصيمية هي للسب المخفف والهجاء مصدرها كَلَفس بفتح الكاف واللام يقال ابن الكلفس , بنت الكلفس , كلفسي",Central,"المهمة: اختر الخيار الذي يوضح الثقافة المرتبطة بكلمة 'كلفسي'.
السؤال: ما الذي يعكسه استخدام كلمة 'كلفسي' في الثقافة القصيمية؟
الخيارات:
أ) الاحترام المتبادل
ب) أسلوب التخاطب الغاضب
ج) شعور الفخر بالتراث
د) الانفتاح الاجتماعي",ب
كلو في الشكلنص,يعني كل شي تمام ٪؜,Central,"المهمة: حدد التفسير الثقافي للتعبير.
السؤال: ما هي القيمة الثقافية وراء استخدام عبارة 'كلو في الشكلنص' في اللهجة الحجازية؟
الخيارات:
أ) تعبير عن الإيجابية والطمأنينة
ب) تعبير عن الاستهزاء
ج) تعبير عن الحزن
د) تعبير عن الخداع",أ
كليمانس,معنى كليمانس النعومه والطيبة وايضا نوع من انواع الزهور,General,"المهمة: حدد ما إذا كانت العبارة التالية صحيحة أم خاطئة.
السؤال: تعكس كلمة 'كليمانس' القيم الثقافية للنعومة والطيبة في المجتمع السعودي.
الخيارات:
أ) صحيح
ب) خطأ",أ
كمبودي,كلمة يقولها حمزة عبداللطيف,Western,"المهمة: فسر استخدام كلمة 'كمبودي' في الثقافة السعودية.
السؤال: ما الدلالة الثقافية لاستخدام كلمة 'كمبودي'؟
الخيارات:
أ) تستخدم للدلالة على الفخر
ب) تستخدم للسخرية
ج) تستخدم في تقدير الشخص
د) تستخدم في التحذير",ب
كمخه,غبي,Southern,"المهمة: اشرح الدلالة الثقافية لكلمة 'كمخه'.
السؤال: ما هي الدلالة الثقافية لكلمة 'كمخه' في اللهجة السعودية؟
الخيارات:
أ) تعبر عن احترام
ب) تشير إلى الإهانة
ج) تعني الود
د) تعبر عن الشجاعة",ب
كُمودينو,كُمودِينُو هي الدولاب الصغير الذي يكون بجانبي السرير عادةً ويسمى المفرد منه كُمودِينَة,Western,"المهمة: اختر الإجاب المناسبة عن الكلمة 'كُمودينو'.
السؤال: ما هو التفسير الثقافي لكلمة 'كُمودينو' في الثقافة الحجازية؟
الخيارات:
أ) يرمز للتقليد الحديث
ب) يرمز للتقاليد الثقافية القديمة
ج) يعبر عن الرفاهية
د) يرتبط بالعادات السلبية",ب
كنادر,كنادر: جمع جزمه ومفردها كندره تعني جزمه,Central,"المهمة: فسر المعنى الثقافي لكلمة 'كنادر'.
السؤال: ما الذي تمثله كلمة 'كنادر' في الثقافة السعودية؟
الخيارات:
أ) ترف ورقي
ب) ضرورة يومية
ج) نوع من الزهور
د) تقليد قديم",ب
كنترة,حذاء.,Western,"المهمة: فسر عبارة 'كنترة' في السياق الثقافي السعودي.
السؤال: ما هي دلالة كلمة 'كنترة' في اللهجة الحجازية؟
الخيارات:
أ) تشير إلى نوع من الملابس
ب) تدل على غلاء الأسعار
ج) تعني الحذاء
د) تستخدم للإشارة إلى الأواني",ج
كنتوش,جميل,Central,"المهمة: اشرح ما تعكسه كلمة 'كنتوش' عن الثقافة.
السؤال: كيف تعبر كلمة 'كنتوش' عن تقدير الجمال في اللهجة الحجازية؟
الخيارات:
أ) تشير إلى الفقر
ب) تعكس الإيجابية والجمال
ج) تعبر عن الحزن
د) تشير إلى العنف",ب
كنجا,كَنّجا: تطلق هذه الكلمة على المرآة السمينة .,Central,"المهمة: اشرح معنى الكلمة 'كنجا' في السياق الثقافي المحلي.
السؤال: ما الذي تعبر عنه كلمة 'كنجا' في الثقافة السعودية؟
الخيارات:
أ) تعبير عن الفخر بالجمال
ب) تعتبر إهانة
ج) رمزية للثروة
د) تعبر عن السعادة",أ
كندرة,جزمة / حذاء,Southern,"المهمة: تفسير استخدام كلمة 'كندرة' في الثقافة السعودية.
السؤال: لماذا تعتبر الكلمة 'كندرة' شائعة في اللهجة السعودية؟
الخيارات:
أ) لأنها تعكس تراث الأحذية المحلية
ب) لأنها تشير إلى نوع من الطعام
ج) لأنها تتعلق بالملابس التقليدية
د) لأنها تعبر عن الأجواء",أ
كنسل,كنسل بمعنى انسى الموضوع.,Western,"المهمة: اشرح المعنى الثقافي لكلمة 'كنسل'.
السؤال: ماذا تعني 'كنسل' في سياق الثقافة السعودية؟
الخيارات:
أ) هي كلمة تشير إلى التخلي عن بعض الآراء.
ب) تعني غضب الشخص من شيء.
ج) تأتي للحديث عن أوقات الفراغ.
د) تشير إلى عدم الرغبة في متابعة الأمر.",د
كوة,الكوة = النافذة، الشباك فمثلا: فكِ الكوة يا أم محمد حاط مفاتيح البيت في الكوة,Central,"المهمة: فسر معنى كلمة 'كوة' في الثقافة السعودية.
السؤال: إلى ماذا تشير 'كوة' في الثقافة السائدة في نجد؟
الخيارات:
أ) هي نافذة تُستخدم لتبادل الحوارات.
ب) هي مدخل للضوء والهواء.
ج) هي جزء من المنزل.
د) ليست لها أي دلالة ثقافية.",ب
كود,فعل تأتي بمعنى: - ليت - يمكن - ربما,Southern,"المهمة: فسير معنى الكلمة بناءً على ثقافة منطقة نجد.
السؤال: كيف يعتبر استخدام كلمة 'كود' في اللهجة النجدية؟
الخيارات:
أ) تعبير عن الاحتمالية
ب) أمر ملزِم
ج) تعبير عن حب
د) تعبير عن الفرح",أ
